{
  "schema_version": "dad.mcp.dependency_map.v1",
  "map_revision": "2026-07-15.1",
  "logical_server_name": "dad-local-graph-surfaces",
  "authority_policy": {
    "local_only": true,
    "read_only": true,
    "remote_enabled": false,
    "execution_authority": false,
    "self_authorizing_refresh": false,
    "host_configuration_write": false
  },
  "required_categories": [
    "identity",
    "protocol",
    "entrypoint",
    "implementation",
    "backend",
    "runtime_data",
    "schema",
    "registry",
    "governance",
    "host_adapter",
    "packaging",
    "navigation",
    "validation",
    "security_authority"
  ],
  "nodes": [
    {
      "node_id": "mcp.node.identity.logical-server",
      "category": "identity",
      "label": "Canonical logical server identity",
      "artifact_kind": "file",
      "change_contract": "A logical-name or implementation change requires parity review in every adapter and host evidence row.",
      "fingerprint": {"kind": "exact_sha256", "path": "assets/mcp/dad-local-readonly/contract.json", "sha256": "sha256:7a1cdda4f07a703d84b894d229998cebe203d3bf6a25c0e7ff3f728cea7a0ea3"}
    },
    {
      "node_id": "mcp.node.protocol.jsonrpc-stdio",
      "category": "protocol",
      "label": "MCP JSON-RPC stdio protocol implementation",
      "artifact_kind": "file",
      "change_contract": "Protocol or method changes require initialize, tools, resources, privacy, and adapter parity checks.",
      "fingerprint": {"kind": "exact_sha256", "path": "src/digital_asset_directory/mcp_server.py", "sha256": "sha256:3158c8b358b6ecc29ca3f9df933e89f7cfdd25da28ed930a439176328a3e1e66"}
    },
    {
      "node_id": "mcp.node.entrypoint.graph-stdio",
      "category": "entrypoint",
      "label": "graph-stdio CLI entrypoint",
      "artifact_kind": "file",
      "change_contract": "The hardcoded module and CLI command coupling must stay identical to all host adapters.",
      "fingerprint": {"kind": "python_symbol_sha256", "path": "src/digital_asset_directory/cli.py", "symbol": "mcp_graph_stdio", "sha256": "sha256:0ec570b70954a43e2825a51babc539d46ec1ced4d77819a73ce7821fc02d8d0e"}
    },
    {
      "node_id": "mcp.node.implementation.server",
      "category": "implementation",
      "label": "Read-only MCP server",
      "artifact_kind": "file",
      "change_contract": "Any edit invalidates the exact implementation fingerprint and requires interface/privacy revalidation.",
      "fingerprint": {"kind": "exact_sha256", "path": "src/digital_asset_directory/mcp_server.py", "sha256": "sha256:3158c8b358b6ecc29ca3f9df933e89f7cfdd25da28ed930a439176328a3e1e66"}
    },
    {
      "node_id": "mcp.node.implementation.dependency-engine",
      "category": "implementation",
      "label": "Dependency freshness and impact engine",
      "artifact_kind": "file",
      "change_contract": "Any edit requires mutation, refusal, privacy, and deterministic replay tests.",
      "fingerprint": {"kind": "exact_sha256", "path": "src/digital_asset_directory/mcp_dependency_map.py", "sha256": "sha256:03b99d326cc94b298308545b6f3f4f741b623094b4be495ebb1099f5f889998d"}
    },
    {
      "node_id": "mcp.node.implementation.compatibility-facade",
      "category": "implementation",
      "label": "Single-server compatibility facade",
      "artifact_kind": "file",
      "change_contract": "The facade must continue to re-export one canonical implementation without new authority.",
      "fingerprint": {"kind": "exact_sha256", "path": "src/digital_asset_directory/mcp_graph_server.py", "sha256": "sha256:f8735cf090424f4500e4668b41e747bb04b19c130b0f2402e81f4f2e1882db50"}
    },
    {
      "node_id": "mcp.node.backend.graph-surfaces",
      "category": "backend",
      "label": "Graph surface read backend",
      "artifact_kind": "file",
      "change_contract": "Only the MCP-consumed graph-surface symbols are fingerprinted; unrelated module edits do not create false staleness.",
      "fingerprint": {"kind": "python_symbols_sha256", "path": "src/digital_asset_directory/graph_surfaces.py", "symbols": ["graph_surface_freshness", "graph_surface_status", "load_graph_surface_registry", "resolve_graph_surface_path"], "sha256": "sha256:6143f1edf14f02f21b22cf837a9d41ceaa6aa6aa68befe08269c3f5eeb33a017"}
    },
    {
      "node_id": "mcp.node.backend.operational-status",
      "category": "backend",
      "label": "Daemon, journal, and surface-version status backends",
      "artifact_kind": "virtual",
      "change_contract": "Import inventory plus exact MCP implementation coverage binds these local status providers without hashing unrelated provider code."
    },
    {
      "node_id": "mcp.node.backend.json-serialization",
      "category": "backend",
      "label": "Canonical JSON serialization",
      "artifact_kind": "file",
      "change_contract": "Only json_dumps semantics affect this server dependency.",
      "fingerprint": {"kind": "python_symbol_sha256", "path": "src/digital_asset_directory/utils.py", "symbol": "json_dumps", "sha256": "sha256:2e219473bd2da484d5cd63504fde3a76c35090dda13567c9643f6cdf2c00ed60"}
    },
    {
      "node_id": "mcp.node.runtime-data.local-hub",
      "category": "runtime_data",
      "label": "Initialized local DAD hub data",
      "artifact_kind": "runtime_data",
      "change_contract": "Runtime data remains local, read-only, source-authority bounded, and is never fingerprinted into repository metadata."
    },
    {
      "node_id": "mcp.node.schema.dependency-map",
      "category": "schema",
      "label": "Strict MCP dependency map schema",
      "artifact_kind": "file",
      "change_contract": "Schema changes require map, validator, registry, and mutation-test updates.",
      "fingerprint": {"kind": "exact_sha256", "path": "schemas/mcp-dependency-map.schema.json", "sha256": "sha256:ba148f9047e1967de9eb3304e4958046be7b96add882a553fcf3611ed40a75ff"}
    },
    {
      "node_id": "mcp.node.schema.graph-surfaces",
      "category": "schema",
      "label": "Graph surface schemas",
      "artifact_kind": "file",
      "change_contract": "Graph-surface contract changes require resource and data-flow review.",
      "fingerprint": {"kind": "exact_sha256", "path": "schemas/graph-surface-registry.schema.json", "sha256": "sha256:2d82deb0cef369141a1542dc8bf4cfb213a9d8bddfd3f6a30dfba637ca9f66b0"}
    },
    {
      "node_id": "mcp.node.registry.dependency-map",
      "category": "registry",
      "label": "Reviewed dependency and blast-radius map",
      "artifact_kind": "file",
      "change_contract": "The map is human-reviewed source metadata; candidate refresh never rewrites it."
    },
    {
      "node_id": "mcp.node.registry.graph-surfaces",
      "category": "registry",
      "label": "Graph surface registry semantics",
      "artifact_kind": "file",
      "change_contract": "Canonical JSON semantics are fingerprinted so formatting-only changes do not create false staleness.",
      "fingerprint": {"kind": "json_pointer_sha256", "path": "registry/graph-surface-registry.json", "pointer": "/surfaces", "sha256": "sha256:7401ee9f3f95438e9d372c2e796d5008534121d1bc45aa09ff9c1e30fd7e60ca"}
    },
    {
      "node_id": "mcp.node.registry.schema-route",
      "category": "registry",
      "label": "Schema registry MCP dependency route",
      "artifact_kind": "file",
      "change_contract": "Only the named MCP schema route is fingerprinted in the shared schema registry.",
      "fingerprint": {"kind": "json_pointer_sha256", "path": "registry/schema-registry.json", "pointer": "/schemas/mcp_dependency_map", "sha256": "sha256:817fb10f67751ba48bac355ea749bc23d911e7fd533aad4ea124d035931dc3da"}
    },
    {
      "node_id": "mcp.node.governance.mcp-first-policy",
      "category": "governance",
      "label": "MCP-first integration policy",
      "artifact_kind": "file",
      "change_contract": "Governance changes require explicit authority and data-direction review before implementation follows.",
      "fingerprint": {"kind": "exact_sha256", "path": "docs/MCP_FIRST_INTEGRATION_POLICY.md", "sha256": "sha256:e4623dea57596b5630eaabd2f70fb944fda6d6337fabb94cf93503d7840d68ba"}
    },
    {
      "node_id": "mcp.node.host-adapter.templates",
      "category": "host_adapter",
      "label": "Vendor-neutral reusable host adapter bundle",
      "artifact_kind": "directory",
      "change_contract": "Every template, contract, evidence schema, and validator must normalize to one server and tool contract.",
      "fingerprint": {"kind": "tree_sha256", "path": "assets/mcp/dad-local-readonly", "sha256": "sha256:9377c09d949f39ab552e3a165cb8208c2ca3540074f8d7a3d63b07eadee6d978"}
    },
    {
      "node_id": "mcp.node.host-adapter.installed-evidence",
      "category": "host_adapter",
      "label": "Privacy-safe installed-host evidence",
      "artifact_kind": "file",
      "change_contract": "Installed/configured/available states are separate from reusable template parity and never imply activation.",
      "fingerprint": {"kind": "exact_sha256", "path": "assets/mcp/dad-local-readonly/installed-host-evidence.json", "sha256": "sha256:c347159eb4c9898ecd3de8e037ae8a3d1a23f04a3d86e7494e4c71caf6d6c508"}
    },
    {
      "node_id": "mcp.node.packaging.asset-dir",
      "category": "packaging",
      "label": "asset-dir console script packaging",
      "artifact_kind": "file",
      "change_contract": "Only the console-script binding is fingerprinted in shared packaging metadata.",
      "fingerprint": {"kind": "toml_pointer_sha256", "path": "pyproject.toml", "pointer": "/project/scripts/asset-dir", "sha256": "sha256:9883c5305cb11bb83f6cd3d1a672ae85331bc338c5c01621e024835146312b0e"}
    },
    {
      "node_id": "mcp.node.navigation.machine-route",
      "category": "navigation",
      "label": "Machine navigation route to the MCP dependency map",
      "artifact_kind": "file",
      "change_contract": "The shared navigation file is tracked by its one MCP route rather than a giant-file hash.",